{
  "schema_version": "1.0",
  "workspace_id": "chat-bus-recovery-20260905",
  "operation_id": "op-000001",
  "sequence": 2,
  "state": "ATTEMPTED",
  "created_at": "2026-09-05T17:06:30Z",
  "writer": {
    "label": "Codex",
    "route": "ChatGPT Work / Chat Communication Bus"
  },
  "action_class": "wip_checkpoint_projection",
  "target": {
    "kind": "github-files",
    "locator": "https://www.github.com/thebrazenbeard/wip/tree/wip/chat-bus-recovery-20260905-v2/workspaces/chat-bus-recovery-20260905"
  },
  "intent_summary": "Create the checkpoint records and projections after the prepared WIP write.",
  "recovery_instruction": "inspect_before_retry",
  "previous_event": "op-000001-01-prepared"
}
