{
  "schema_version": "1.0",
  "workspace_id": "parallax-chat-bus-hardening-v1",
  "operation_id": "op-000002",
  "sequence": 2,
  "state": "ATTEMPTED",
  "created_at": "2026-09-05T16:39:18.631Z",
  "writer": {
    "label": "Parallax",
    "route": "Radar Station Work task / Parallax"
  },
  "action_class": "CHAT_BUS_TOPOLOGY_ONBOARDING",
  "target": {
    "kind": "GITHUB_REPOSITORY",
    "locator": "thebrazenbeard/chat-communication-bus",
    "expected_precondition": "main is b2950bcb547fb78d16e44cd94a6ba2164937bf44 and bus/parallax-v1 is an inert exact-cut branch."
  },
  "intent_summary": "Create inert bus/parallax-v1 and open a reviewed topology/bootstrap PR.",
  "recovery_instruction": "inspect_before_retry",
  "previous_event": "op-000002-01-prepared",
  "result_summary": "Branch creation was attempted; exact-head readback and topology PR remain pending."
}
