{
  "schema_version": "1.0",
  "workspace_id": "chat-bus-recovery-20260905",
  "operation_id": "op-000001",
  "sequence": 2,
  "state": "VERIFIED",
  "created_at": "2026-09-05T17:04:08Z",
  "writer": {
    "label": "Codex",
    "route": "ChatGPT Work / Chat Communication Bus"
  },
  "action_class": "wip_checkpoint_branch_and_records",
  "target": {
    "kind": "github-branch",
    "locator": "https://github.com/thebrazenbeard/wip/tree/wip/chat-bus-recovery-20260905",
    "expected_precondition": "wip records created on the isolated branch"
  },
  "intent_summary": "Verify exact readback of the public-safe Chat Bus recovery workspace records.",
  "recovery_instruction": "no_retry_required",
  "previous_event": "op-000001-01-reconciled",
  "result_summary": "WORKSPACE.json, cp-000001.json, the prior operation event, HEAD.json, and RESUME.md all read back successfully from the isolated branch.",
  "effect_receipt": {
    "kind": "github-file-readback",
    "value": "5 of 5 workspace records readable",
    "readback": "GitHub readback succeeded for all five paths; blob SHAs recorded in the completion receipt."
  }
}
