{
  "schema_version": "1.0",
  "workspace_id": "parallax-chat-bus-hardening-v1",
  "operation_id": "op-000004",
  "sequence": 3,
  "state": "VERIFIED",
  "created_at": "2026-09-05T17:13:46.335Z",
  "writer": {
    "label": "Parallax",
    "route": "Radar Station Work task / Parallax"
  },
  "action_class": "CHAT_BUS_TELEMETRY_HARDENING",
  "target": {
    "kind": "GITHUB_REPOSITORY",
    "locator": "thebrazenbeard/chat-communication-bus",
    "expected_precondition": "PR #22 exact head and CI were read back."
  },
  "intent_summary": "Verify durable telemetry heartbeat implementation and exact-head CI.",
  "recovery_instruction": "no_retry_required",
  "previous_event": "op-000004-02-attempted",
  "result_summary": "PR #22 exact head 7cfe41e68f... passed CI run 33980199378 on Python 3.11/3.12 with pytest, compileall, and source-hash verification.",
  "effect_receipt": {
    "kind": "GITHUB_DRAFT_PR_VERIFIED",
    "value": "thebrazenbeard/chat-communication-bus#22",
    "readback": "Open Draft, unmerged; no provider effect."
  }
}
