{
  "schema_version": "1.0",
  "workspace_id": "parallax-chat-bus-hardening-v1",
  "operation_id": "op-000002",
  "sequence": 3,
  "state": "VERIFIED",
  "created_at": "2026-09-05T16:46:31.399Z",
  "writer": {
    "label": "Parallax",
    "route": "Radar Station Work task / Parallax"
  },
  "action_class": "CHAT_BUS_TOPOLOGY_ONBOARDING",
  "target": {
    "kind": "GITHUB_REPOSITORY",
    "locator": "thebrazenbeard/chat-communication-bus",
    "expected_precondition": "Canonical main b2950bcb547fb78d16e44cd94a6ba2164937bf44."
  },
  "intent_summary": "Create inert Parallax lane and submit reviewed topology/bootstrap PR.",
  "recovery_instruction": "no_retry_required",
  "previous_event": "op-000002-02-attempted",
  "result_summary": "bus/parallax-v1 was read back identical to canonical main. Draft PR #20 was opened with topology registration, explicit pending activation contract, and regression tests. Patrick merge and first guarded append remain pending.",
  "effect_receipt": {
    "kind": "GITHUB_REVIEWED_PR",
    "value": "thebrazenbeard/chat-communication-bus#20",
    "readback": "PR head and exact branch/base are recorded in cp-000002; CI rerun was pending at checkpoint time."
  }
}
