{
  "schema_version": "1.0",
  "workspace_id": "chat-bus-recovery-20260905",
  "operation_id": "op-000001",
  "sequence": 1,
  "state": "PREPARED",
  "created_at": "2026-09-05T17:06:17Z",
  "writer": {
    "label": "Codex",
    "route": "ChatGPT Work / Chat Communication Bus"
  },
  "action_class": "wip_checkpoint_projection",
  "target": {
    "kind": "github-files",
    "locator": "https://github.com/thebrazenbeard/wip/tree/wip/chat-bus-recovery-20260905-v2/workspaces/chat-bus-recovery-20260905",
    "expected_precondition": "new isolated WIP branch from WIP main"
  },
  "intent_summary": "Persist and register the public-safe Chat Bus recovery checkpoint.",
  "recovery_instruction": "inspect_before_retry",
  "previous_event": null
}
