{
  "schema_version": "1.0",
  "workspace_id": "parallax-chat-bus-hardening-v1",
  "operation_id": "op-000002",
  "sequence": 1,
  "state": "PREPARED",
  "created_at": "2026-09-05T16:38:33.359Z",
  "writer": {
    "label": "Parallax",
    "route": "Radar Station Work task / Parallax"
  },
  "action_class": "CHAT_BUS_TOPOLOGY_ONBOARDING",
  "target": {
    "kind": "GITHUB_REPOSITORY",
    "locator": "thebrazenbeard/chat-communication-bus",
    "expected_precondition": "main is b2950bcb547fb78d16e44cd94a6ba2164937bf44 and bus/parallax-v1 does not yet carry messages."
  },
  "intent_summary": "Create inert bus/parallax-v1 from the exact canonical cut and open a Bus-local reviewed topology/bootstrap PR without merging it.",
  "recovery_instruction": "inspect_before_retry",
  "previous_event": null
}
