{
  "schema_version": "1.0",
  "workspace_id": "chat-bus-recovery-20260905",
  "operation_id": "op-000001",
  "sequence": 1,
  "state": "RECONCILED",
  "created_at": "2026-09-05T17:01:18Z",
  "writer": {
    "label": "Codex",
    "route": "ChatGPT Work / Chat Communication Bus"
  },
  "action_class": "wip_checkpoint_branch_and_records",
  "target": {
    "kind": "github-branch",
    "locator": "https://github.com/thebrazenbeard/wip/tree/wip/chat-bus-recovery-20260905",
    "expected_precondition": "branch created from WIP main at 12a7c23dbe0482fd7bfe63659e54526778efef1e"
  },
  "intent_summary": "Persist the public-safe Chat Bus recovery checkpoint and make it discoverable to a replacement chat.",
  "recovery_instruction": "no_retry_required",
  "previous_event": null,
  "result_summary": "WIP branch and recovery records were created; exact file readback is required before treating this checkpoint as verified.",
  "effect_receipt": {
    "kind": "github-branch-and-files",
    "value": "wip/chat-bus-recovery-20260905",
    "readback": "Pending final exact readback in this turn."
  }
}
